{
  "version": "cypher-llm-contract-conformance/v1",
  "generatedAt": "2026-05-10",
  "compatibilityCatalogVersion": "cypher-llm-compatibility-catalog/v1",
  "packageName": "@evalops/cypher-llm-compiler",
  "packageVersion": "0.1.0",
  "summary": {
    "contracts": 29,
    "passedContracts": 29,
    "warningContracts": 0,
    "failedContracts": 0,
    "checks": 213,
    "warnings": 0,
    "failures": 0,
    "missingFiles": 0,
    "fingerprintMismatches": 0,
    "schemaValidationFailures": 0
  },
  "contracts": [
    {
      "id": "cypher-query-ir",
      "version": "cypher-llm-ir/v1",
      "level": "stable",
      "status": "pass",
      "checks": [
        {
          "id": "schema-file",
          "status": "pass",
          "path": "schemas/cypher-query.schema.json",
          "message": "File exists."
        },
        {
          "id": "fingerprint",
          "status": "pass",
          "path": "schemas/cypher-query.schema.json",
          "message": "Fingerprint matches."
        },
        {
          "id": "example-file",
          "status": "pass",
          "path": "examples/tool-hash.query.json",
          "message": "File exists."
        },
        {
          "id": "fingerprint",
          "status": "pass",
          "path": "examples/tool-hash.query.json",
          "message": "Fingerprint matches."
        },
        {
          "id": "schema-validation",
          "status": "pass",
          "path": "examples/tool-hash.query.json",
          "message": "Example validates against schema."
        },
        {
          "id": "evidence-file",
          "status": "pass",
          "path": "src/ir.ts",
          "message": "File exists."
        },
        {
          "id": "evidence-file",
          "status": "pass",
          "path": "src/render.ts",
          "message": "File exists."
        },
        {
          "id": "evidence-file",
          "status": "pass",
          "path": "test/render.test.ts",
          "message": "File exists."
        }
      ]
    },
    {
      "id": "schema-contract",
      "version": "cypher-llm-schema/v1",
      "level": "stable",
      "status": "pass",
      "checks": [
        {
          "id": "schema-file",
          "status": "pass",
          "path": "schemas/cypher-schema-contract.schema.json",
          "message": "File exists."
        },
        {
          "id": "fingerprint",
          "status": "pass",
          "path": "schemas/cypher-schema-contract.schema.json",
          "message": "Fingerprint matches."
        },
        {
          "id": "example-file",
          "status": "pass",
          "path": "examples/tool-hash.schema.json",
          "message": "File exists."
        },
        {
          "id": "fingerprint",
          "status": "pass",
          "path": "examples/tool-hash.schema.json",
          "message": "Fingerprint matches."
        },
        {
          "id": "schema-validation",
          "status": "pass",
          "path": "examples/tool-hash.schema.json",
          "message": "Example validates against schema."
        },
        {
          "id": "evidence-file",
          "status": "pass",
          "path": "src/ir.ts",
          "message": "File exists."
        },
        {
          "id": "evidence-file",
          "status": "pass",
          "path": "src/schema.ts",
          "message": "File exists."
        },
        {
          "id": "evidence-file",
          "status": "pass",
          "path": "test/compiler-loop.test.ts",
          "message": "File exists."
        }
      ]
    },
    {
      "id": "diagnostic-shape",
      "version": "cypher-llm-diagnostic/v1",
      "level": "stable",
      "status": "pass",
      "checks": [
        {
          "id": "example-file",
          "status": "pass",
          "path": "examples/lsp/tool-hash.lsp.json",
          "message": "File exists."
        },
        {
          "id": "fingerprint",
          "status": "pass",
          "path": "examples/lsp/tool-hash.lsp.json",
          "message": "Fingerprint matches."
        },
        {
          "id": "example-file",
          "status": "pass",
          "path": "examples/proofs/tool-hash.proof.json",
          "message": "File exists."
        },
        {
          "id": "fingerprint",
          "status": "pass",
          "path": "examples/proofs/tool-hash.proof.json",
          "message": "Fingerprint matches."
        },
        {
          "id": "evidence-file",
          "status": "pass",
          "path": "src/diagnostics.ts",
          "message": "File exists."
        },
        {
          "id": "evidence-file",
          "status": "pass",
          "path": "src/validate.ts",
          "message": "File exists."
        },
        {
          "id": "evidence-file",
          "status": "pass",
          "path": "docs/COMPATIBILITY.md",
          "message": "File exists."
        }
      ]
    },
    {
      "id": "diagnostic-catalog",
      "version": "cypher-llm-diagnostic-catalog/v1",
      "level": "stable",
      "status": "pass",
      "checks": [
        {
          "id": "schema-file",
          "status": "pass",
          "path": "schemas/diagnostic-catalog.schema.json",
          "message": "File exists."
        },
        {
          "id": "fingerprint",
          "status": "pass",
          "path": "schemas/diagnostic-catalog.schema.json",
          "message": "Fingerprint matches."
        },
        {
          "id": "example-file",
          "status": "pass",
          "path": "examples/diagnostics/diagnostic-catalog.json",
          "message": "File exists."
        },
        {
          "id": "fingerprint",
          "status": "pass",
          "path": "examples/diagnostics/diagnostic-catalog.json",
          "message": "Fingerprint matches."
        },
        {
          "id": "schema-validation",
          "status": "pass",
          "path": "examples/diagnostics/diagnostic-catalog.json",
          "message": "Example validates against schema."
        },
        {
          "id": "evidence-file",
          "status": "pass",
          "path": "src/diagnostic-catalog.ts",
          "message": "File exists."
        },
        {
          "id": "evidence-file",
          "status": "pass",
          "path": "test/diagnostic-catalog.test.ts",
          "message": "File exists."
        }
      ]
    },
    {
      "id": "eval-dataset",
      "version": "cypher-llm-eval-dataset/v1",
      "level": "stable",
      "status": "pass",
      "checks": [
        {
          "id": "schema-file",
          "status": "pass",
          "path": "schemas/eval-dataset.schema.json",
          "message": "File exists."
        },
        {
          "id": "fingerprint",
          "status": "pass",
          "path": "schemas/eval-dataset.schema.json",
          "message": "Fingerprint matches."
        },
        {
          "id": "example-file",
          "status": "pass",
          "path": "examples/eval-dataset.json",
          "message": "File exists."
        },
        {
          "id": "fingerprint",
          "status": "pass",
          "path": "examples/eval-dataset.json",
          "message": "Fingerprint matches."
        },
        {
          "id": "schema-validation",
          "status": "pass",
          "path": "examples/eval-dataset.json",
          "message": "Example validates against schema."
        },
        {
          "id": "evidence-file",
          "status": "pass",
          "path": "src/evals.ts",
          "message": "File exists."
        },
        {
          "id": "evidence-file",
          "status": "pass",
          "path": "test/evals.test.ts",
          "message": "File exists."
        }
      ]
    },
    {
      "id": "eval-attempts",
      "version": "cypher-llm-eval-attempts/v1",
      "level": "stable",
      "status": "pass",
      "checks": [
        {
          "id": "schema-file",
          "status": "pass",
          "path": "schemas/eval-attempts.schema.json",
          "message": "File exists."
        },
        {
          "id": "fingerprint",
          "status": "pass",
          "path": "schemas/eval-attempts.schema.json",
          "message": "Fingerprint matches."
        },
        {
          "id": "example-file",
          "status": "pass",
          "path": "examples/eval-attempts.json",
          "message": "File exists."
        },
        {
          "id": "fingerprint",
          "status": "pass",
          "path": "examples/eval-attempts.json",
          "message": "Fingerprint matches."
        },
        {
          "id": "schema-validation",
          "status": "pass",
          "path": "examples/eval-attempts.json",
          "message": "Example validates against schema."
        },
        {
          "id": "evidence-file",
          "status": "pass",
          "path": "src/evals.ts",
          "message": "File exists."
        },
        {
          "id": "evidence-file",
          "status": "pass",
          "path": "test/evals.test.ts",
          "message": "File exists."
        }
      ]
    },
    {
      "id": "dialect-profile",
      "version": "cypher-llm-dialect-profile/v1",
      "level": "stable",
      "status": "pass",
      "checks": [
        {
          "id": "schema-file",
          "status": "pass",
          "path": "schemas/dialect-profile.schema.json",
          "message": "File exists."
        },
        {
          "id": "fingerprint",
          "status": "pass",
          "path": "schemas/dialect-profile.schema.json",
          "message": "Fingerprint matches."
        },
        {
          "id": "example-file",
          "status": "pass",
          "path": "profiles/neo4j-cypher-25.json",
          "message": "File exists."
        },
        {
          "id": "fingerprint",
          "status": "pass",
          "path": "profiles/neo4j-cypher-25.json",
          "message": "Fingerprint matches."
        },
        {
          "id": "schema-validation",
          "status": "pass",